<!ELEMENT cd (canciones | data)>
<!ATTLIST cd titulo CDATA #REQUIRED>

<!ELEMENT canciones (cancion+)>

<!ELEMENT cancion (titulo, compositores, productores, sello, artista)>
<!ATTLIST cancion duracion CDATA #REQUIRED>
<!ATTLIST cancion anio CDATA #REQUIRED>

<!ELEMENT titulo (#PCDATA)>

<!ELEMENT compositores (compositor+)>
<!ELEMENT compositor (nombres, apellidos)>
<!ELEMENT nombres (#PCDATA)>
<!ELEMENT apellidos (#PCDATA)>

<!ELEMENT productores (productor+)>
<!ELEMENT productor (nombres, apellidos)>

<!ELEMENT sello (#PCDATA)>
<!ELEMENT artista (#PCDATA)>

<!ELEMENT data EMPTY>
<!ATTLIST data dia CDATA #REQUIRED>
<!ATTLIST data mes CDATA #REQUIRED>
<!ATTLIST data anio CDATA #REQUIRED>
